3.0-split-https://twitter.com/HuffPost-split-We've detected that JavaScript is disabled in your browser. Would you like to proceed to legacy Twitter? Yes Know what's real. Are you sure you want to view these Tweets? Viewing Tweets won't unblock @HuffPost The 2018 midterm elections aren’t until Nov. 6, but the deadlines for registering to vote in them are quickly approaching.http://huffp.st/b1yWf92 Two Muslim groups have already raised more than $50,000 for victims of Saturday's Pittsburgh synagogue shooting.http://huffp.st/uh7xPhQ An editorial cartoon compares Saturday's massacre at a Pittsburgh synagogue to the Nazi "Kristallnacht."http://huffp.st/cthHoVo Brazilians will be heading to the polls on Sunday.http://huffp.st/tCBidwG The jackpot is the fourth-largest in U.S. history.http://huffp.st/GX9MSCu Just months ago, the rabbi of a Pittsburgh synagogue where a gunman killed 11 people decried weak gun control and politicians' inaction in a message to congregants.http://huffp.st/zRgEWdS "Aside from the occasional short visit, Adam never knew the state or its people."http://huffp.st/Uqyrz9X Pittsburgh shooting victims: Joyce Feinberg, 75 Richard Gottfried, 65 Rose Mallinger, 97 Jerry Rabinowitz, 66 Cecil Rosenthal, 59 David Rosenthal, 54 Bernice Simon, 84 Sylvan Simon, 86 Daniel Stein, 71 Melvin Wax, 88 Irving Youngner, 69http://huffp.st/2dQkRxu President Donald Trump said the person responsible for the Pittsburgh synagogue shooting should "pay the ultimate price."http://huffp.st/SVTx076 "We have to stop making it so easy for those who want to harm the innocent to get their hands on a gun," Barack Obama tweeted Saturday.http://huffp.st/eTFpk1x Mourners flooded the streets in front of the Tree of Life synagogue in Pittsburgh with candles, prayer and a plea to stop hate.http://huffp.st/r64KCaO Allegheny County medical examiner Karl Williams provided information about the victims at a news conference Sunday morning. They included two brothers and a husband and wife.http://huffp.st/2dQkRxu Comedian Jim Carrey took the passionate political message of his paintings and turned it into a stirring awards show speech.http://huffp.st/FAFQ33X The helicopter crashed in a ball of flames in the club's car park on Saturday.http://huffp.st/bnF3vGj Latinas are facing a dangerous birth complication, and anti-immigrant sentiment may be to blame.http://huffp.st/6d1sL7M "They’re not coming to get anyone. They’re seeking relief from their hell at home. And that’s the truth," Shepard Smith told views about a migrant caravan.http://huffp.st/M6J19YX Michelle Obama wants you to start a voting squad to ensure turnout in the midterm elections.http://huffp.st/LngLch5 People cry when they meet her. Others just want to touch her. Democrat Paulette Jordan is the underdog in Idaho's governor's race, but voters in both parties cannot get enough of her.http://huffp.st/SqhKbPI A generation of children have had their lives torn apart before they’ve even learned how to read. These are the children the opioid crisis has left behind.http://huffp.st/4QCVKeB Amber Olsen's daughter Willow is dying. Now Amber must do the work of an entire industry – by herself – just for a chance to slow the progression of a disease that’s already robbed her daughter of her ability to dance, walk and eat.http://huffp.st/RZl2uw9 Ann Coulter suggested Donald Trump should give the order for U.S. troops to invade Mexico.http://huffp.st/3AaN4QJ @HuffPost hasn't Tweeted yet. Back to top ↑ Twitter may be over capacity or experiencing a momentary hiccup. Try again or visit Twitter Status for more information.  You can add location information to your Tweets, such as your city or precise location, from the web and via third-party applications. You always have the option to delete your Tweet location history. Learn more Here's the URL for this Tweet. Copy it to easily share with friends. Add this Tweet to your website by copying the code below. Learn more Add this video to your website by copying the code below. Learn more Hmm, there was a problem reaching the server. Try again? By embedding Twitter content in your website or app, you are agreeing to the Twitter Developer Agreement and Developer Policy. This timeline is where you’ll spend most of your time, getting instant updates about what matters to you. Hover over the profile pic and click the Following button to unfollow any account. When you see a Tweet you love, tap the heart — it lets the person who wrote it know you shared the love. The fastest way to share someone else’s Tweet with your followers is with a Retweet. Tap the icon to send it instantly. Add your thoughts about any Tweet with a Reply. Find a topic you’re passionate about, and jump right in. Get instant insight into what people are talking about now. Follow more accounts to get instant updates about topics you care about. See the latest conversations about any topic instantly. Catch up instantly on the best stories happening as they unfold.
4.0-split-https://www.foxnews.com/opinion.html-split-This material may not be published, broadcast, rewritten, or redistributed. ©2018 FOX News Network, LLC. All rights reserved. All market data delayed 20 minutes. Democrats on the midterm-campaign trail have trotted out their fabrications about Republicans demolishing medical coverage. Alaska isn’t normally much on the national political radar, but by the end of Nov. 6 it could hold some notable distinctions. The best way for Republicans to earn the votes of undecided voters is to clearly articulate how they would fix our broken health- care system. America must continue showing a strong, united front against China’s efforts to lie, steal and cheat its way to being the world’s economic leader. The Pittsburgh synagogue shooting shows anti-Semitism is a serious problem in America that must not be ignored. In the last few weeks, health officials in a number of states have reported deaths attributable to flu. The global financial crisis that hit 10 years ago has remarkable similarities to a much earlier crisis that most people today have never heard of – in 1287 in England. It all started with words from my doctor that I never expected to hear. President Trump and Republicans drew harsh media criticism this past week linking them to the actions of the person who mailed homemade bombs to former President Obama, Hillary Clinton and other Trump critics. The shooting at the Pittsburgh synagogue where I prayed for years continues the long history of anti-Semitism. The Pittsburgh synagogue shooting and the pipe bomb mailings are rooted in hatred. A recent Statista survey reported that Americans are more stressed out than they were decades ago. My entire adult life, I’ve been enamored with house and home and making beautiful things. Latest opinion cartoons from FoxNews.com After the Pittsburgh synagogue attack we must fight anti-Semitism and improve security measures. Democrats on the midterm-campaign trail have trotted out their fabrications about Republicans demolishing medical coverage. President Trump should convene a meeting of religious leaders to work against hatred, in the wake of the synagogue mass murder in Pittsburgh. The horrific shooting at a Pittsburgh synagogue Saturday, in which 11 people were killed and six people – including four police officers – were injured is a reminder that the cancer of anti-Semitism continues. Alaska isn’t normally much on the national political radar, but by the end of Nov. 6 it could hold some notable distinctions. This material may not be published, broadcast, rewritten, or redistributed. ©2018 FOX News Network, LLC. All rights reserved. All market data delayed 20 minutes.
4.0-split-https://www.foxnews.com/politics.html-split-This material may not be published, broadcast, rewritten, or redistributed. ©2018 FOX News Network, LLC. All rights reserved. All market data delayed 20 minutes. Texas Rep. Beto O'Rourke is touting his new endorsements from several leading Texas newspapers in his insurgent bid to unseat incumbent Sen. Ted Cruz, while the GOP makes apparent gains in several wild gubernatorial and Senate races. Follow the latest predictions in this year’s House, Senate and gubernatorial races with Fox News' Power Rankings. Click for the latest race ratings and full midterm coverage.  Texas Rep. Beto O'Rourke is touting his new endorsements by several leading Texas newspapers in his insurgent bid to unseat incumbent Sen. Ted Cruz, even as the GOP makes gains in several Senate and gubernatorial races. Sen. James Lankford, R-Okla., said Sunday that while President Trump needs to more clear and less caustic in his language, he doesn’t believe there is any connection between the president’s rhetoric and Saturday’s mass shooting in Pittsburgh. Does he lie, and does it matter? Following reports that Mexican police toting plastic shields abandoned their blockades in the face of a swelling Central American migrant caravan over the weekend, Defense Secretary Jim Mattis announced Sunday that the U.S. military has already begun delivering resources to the U.S.-Mexico border. Both sides score points, depending on the target. He hits 'hateful' press over explosive packages. Rep. Kevin Brady breaks down a possible plan and timeline for new tax cuts on 'Sunday Morning Futures.' On 'Sunday Morning Futures,' the Homeland Security committee chair reacts to the response to the deadly synagogue shooting and wave of package bombs and speaks out on the threat posed by the migrant caravan. In the wake of the tragic mass shooting at synagogue in his city that left 11 people dead and six others wounded, Pittsburgh Mayor Bill Peduto balked at President Trump’s statement that the massacre could have been prevented if the house of worship had employed an armed guard. Texas Republican speaks out on America's mental health crisis, the debate over immigration policy, questions for Rosenstein and more. Department of Homeland Security Secretary Kirstjen Nielsen called the mass shooting in a Pittsburgh synagogue on Saturday “a pure act of evil” and noted that DHS officials had previously visited the house of worship to give advice to its staff on a possible active shooter scenario. At the end of an ugly week of political violence, it's reassuring to know most of the campaigning followed familiar lines: Tough rhetoric, funny moments and President Trump at center stage. From the Cuban missile crisis to the Foley scandal, October surprises have changed the course of elections. Democrats need to flip at least 23 seats to take over control of the House of Representatives; insight from Rep. Ben Ray Luján, chair of the Democratic Congressional Campaign Committee, and Rep. Steve Stivers, head of the National Republican Congressional Committee. Exclusive: Homeland Security Secretary Kirstjen Nielsen weighs in on the attack on the Tree of Life synagogue in Pittsburgh, the arrest of a Florida man accused of sending package bombs to prominent Democrats and efforts to derail the migrant caravan from Central America. Insight from Ned Ryun, former writer for President George W. Bush. Al Sharpton accuses President Trump of using young blacks as props at White House event; reaction from Turning Point USA founder Charlie Kirk. Insight from Fox News national security strategist Dr. Sebastian Gorka, former deputy assistant to the president. From Supreme Court appointments to a summit with Kim Jong Un, Trump's 2016 deputy campaign manager David Bossie weighs in on the president's victories. Michigan candidate John James says Democratic Party leadership cares more about the black vote than the black people. If Democrats were in control of military spending, would the Pentagon's budget be jeopardized? Reaction and analysis from Hudson Institute fellow Rebeccah Heinrichs. This material may not be published, broadcast, rewritten, or redistributed. ©2018 FOX News Network, LLC. All rights reserved. All market data delayed 20 minutes.
7.0-split-https://www.usatoday.com/news/-split-Settings Cancel Set Hi Already a subscriber? Subscribe to USA TODAY Already a print edition subscriber, but don't have a login? Manage your account settings. Support Log Out Get the news Updated 10:49 a.m. EDT Indictments? No problem for two GOP congressmen Shooting victims mourned at candle-light vigil Trump, others on Pittsburgh synagogue shooting Facebook uncovers Iran disinformation to sow discord on Trump, race Squirrel Hill community reflects on hate crime How bombing suspect got caught: A fingerprint, DNA match Obama goes after Trump in Milwaukee speech Ideal community? America’s 50 best cities to live Feds warn every US diocese: Save abuse evidence 'I will never be the same person I was': After school shooting, Santa Fe still reeling More weed killer in cereal, new study shows Pence: No link between Trump language, violence The day in pictures Mayor: 'Darkest day of Pittsburgh history' Two winners to split $687 million Powerball jackpot Politics, culture, personal finance and more: Get all the news right to your inbox Pittsburgh shooting suspect: 'I just want to kill Jews' Adenovirus outbreak kills 9th child in N.J. Mail bomber suspect showed early signs of mental issues What we know now: How police captured the Pittsburgh shooter What 'This Is Us' gets right, wrong about IVF Marines: Oust officer for sex harassment Passages 2018: Those we’ve lost through the year Pittsburgh shooting neighborhood is a Jewish enclave, Mr. Rogers' neighborhood WATCH: Update on synagogue mass shooting Synagogues around the nation beef up security A link has been posted to your Facebook feed. Who is alleged Pittsburgh shooter Robert Bowers? Pittsburgh synagogue shooting: What we know A 97-year-old, an elderly wife and husband: The 11 Pittsburgh victims Indictments? No problem for two GOP congressmen What we know now: How police captured the Pittsburgh shooter Pittsburgh shooting neighborhood is a Jewish enclave, Mr. Rogers' neighborhood © 2018 USA TODAY, a division of Gannett Satellite Information Network, LLC.  
8.0-split-http://news.google.com/-split-The Jewish congregants were there to celebrate life, but were met by death. Most never had a chance. Just before 10 a.m. Saturday, suspected gunman Robert ... A gunman opened fire at a synagogue in the Squirrel Hill neighborhood of Pittsburgh, Pa., killing 11 people and injuring six others, including four police officers. For many years, I attended services to pray at the Tree of Life Synagogue in Pittsburgh, mere blocks from my home. I know the families of some of the 11 people ... The bloodshed in the Tree of Life synagogue is a sign that hatred of The Other is poisoning our public life. Robert Bowers has been identified as the suspect in a deadly shooting at Tree of Life synagogue on Pittsburgh's east end. Bowers has been charged with 29 ... Eleven people were killed in Saturday's shooting at the Tree of Life synagogue in Pittsburgh, according to Curt Conrad, chief of staff for Pittsburgh City ... Multiple people have been killed, six others injured including four officers and a suspect is in custody following a shooting at a Pittsburgh synagogue Saturday. At least 10 people were killed in a Pittsburgh synagogue shooting Saturday morning. Must this nation worship only behind bars and guards? Twitter harassers like Sayoc often aren't banned because their behavior falls just short of what Twitter traditionally defines as harassment. Cesar Sayoc allegedly built pipe bombs sent to Democratic leaders, Trump critics and media in the van he lived in, sources say. MIAMI—Madeline Giardiello woke up from surgery Friday morning to find out that her son, 56-year-old Cesar Sayoc, had just been arrested by the FBI for ... Donald Trump was a Democratic real estate developer the first time Cesar Sayoc was arrested on bomb-related charges. That was back in 2002. Sayoc has also ... Relatives say mail bomber suspect Cesar Sayoc showed early signs of mental health problems that began as a young adult, but he never received help. Brazilians began voting Sunday in a divisive presidential race expected to elect combative ex-army captain Jair Bolsonaro, shifting the country's politics sharply ... Brazilians will head to the polls on Sunday to pick their next President in a run-off vote. Latest opinion polls suggest controversial far-right candidate Ja... Millions of Brazilians vote on Sunday, choosing between two very different politicians to be their next president. Far-right candidate Jair Bolsonaro faces leftist ... The likely election of neo-fascist presidential candidate Jair Bolsonaro is raising fears that Brazil could be the latest country hit by a wave of far-right ... Sao Paulo, Brazil - Brazilians go to the polls on Sunday to elect their next president, with most signs suggesting that South America's most populous nation will ... This is what they had long been fearing. As the threats increased, as the online abuse grew increasingly vicious, as the defacing of synagogues and community ... In the hours after the Pittsburgh synagogue shooting, President Trump's allies were at pains to point out that Robert Bowers, the alleged shooter, was in fact ... The two winning ticket holders — one in Iowa, one in New York — will fork over more than 45 percent in taxes for their half of the $687.8 Powerball haul. Powerball players in Iowa and New York are waking up a lot richer on Sunday following Saturday night's massive drawing. Winning tickets were sold in those ... The winning numbers were 8, 12, 13, 19 and 27. The Powerball is 4. The winning numbers for the estimated $687.8 million Powerball jackpot, the fourth largest in the lottery's history, were drawn Saturday night. One single ticket had all of the numbers to lay claim to the $1.537 billion Mega Millions jackpot earlier this week but 14 Wake County co-workers managed to ... A Department of Homeland Security adviser visited the Pittsburgh synagogue that was the site of a mass shooting Saturday "as recently as March," Homeland ... Department of Homeland Security (DHS) Secretary Kirstjen Nielsen on Sunday condemned a shooting at a Pittsburgh synagogue that left 11 dead, calling it a ... Homeland Security Secretary Kirstjen Nielsen has a message for the migrant caravan moving from Central America towards the U.S.-Mexico border: "Do not ... A caravan of Central American immigrants headed for the U.S. through Mexico "is not getting in," Homeland Security Secretary Kirstjen Nielsen vows. Department of Homeland Security (DHS) Secretary Kirstjen Nielsen said Sunday that President Trump is considering "every possible action" to prevent a ... Washington (CNN) House Majority Leader Kevin McCarthy posted and later deleted a tweet last week that suggested three Jewish, billionaire Democratic ... House Majority Leader Kevin McCarthy (R-Calif.) deleted a tweet that had warned that three wealthy Jewish Democrats are “buying” the midterm elections for ... Rep. Kevin McCarthy, R-Calif., is under scrutiny after it was revealed that he posted a tweet which could be construed as anti-Semitic after a bomb was sent to ... PRAGUE — U.S. Defense Secretary Jim Mattis said his talks with European allies so far have not resulted in any suggestions of how to deal with Russia's ... U.S. Defense Secretary Jim Mattis said on Sunday that the United States was in consultation with its European allies on an arms control treaty, as NATO ... The INF treaty reflected a conservative worldview built around alliances. Ongoing Russian violations of the Intermediate Range Nuclear Forces (INF) Treaty need to be effectively addressed because they defy a longstanding bilateral ... The Trump administration's plan to withdraw from the Intermediate-Range Nuclear Forces Treaty (INF) is the wrong way to respond to a real problem. If carried ... Nearly 7000 people traveling through a migrant caravan to reach the U.S. border agreed to rest on Sunday following a report of an abducted child. Coordinators of a caravan of several thousand Central American migrants moving through southern Mexico urged its members to rest Sunday. At first the ... Mexican officials had promised shelter, medical attention, schooling and jobs to members of the Central American caravan who would ditch their plans to reach ... The migrant caravan Trump is so obsessed about is a direct result of US foreign policy. Immigration and trade are now closely linked, at least in Mr. Trump's mind. There lies part of the current caravan crisis. It is not just Trumpian electioneering. An ethnic Uighur Muslim family's struggle to stay in Sweden illustrates the risks for a people whose plight, until recently, had received little attention. BEIJING — In China's western Xinjiang region, populated by mostly Turkic-speaking Muslims, up to one in 12 Muslim residents languish in political re-education ... Editorial: Courageous personal testimony and painstaking research are giving us an increasingly detailed and shocking view of the centres in Xinjiang where ... One person has been killed after a Sri Lankan MP's bodyguard fired at a mob amid a growing political crisis. It happened as protesters blocked Arjuna ... COLOMBO, Sri Lanka — Sri Lanka appeared on the brink of a constitutional crisis Saturday with two men each claiming to be the country's rightful prime minister ... Sri Lanka's political crisis has deepened a day after the president sacked the prime minister. President Maithripala Sirisena has now also suspended Parliame... Sri Lankans watch a televised speech by president Maithripala Sirisena at their residence in Colombo, Sri Lanka, Sunday, Oct. 28, 2018. (AP Photo/Eranga ... A constitutional crisis gripping Sri Lanka since the president's shock dismissal of Prime Minister Ranil Wickremesinghe erupted into violence Sunday, with a man ... Two weeks after National Dessert Day and three days before Halloween, Oct. 28 is National Chocolate Day. The yield is 16.%, and going ex-dividend on 11/6/18. Management just made an acquisition which will improve its distribution coverage to well over 1X, starting. Pretty much everything has been said about Tesla: it was selling vehicles at a loss and would never be able to make them under the right conditions and fast ... It's arguably unfathomable that any human being slapped with a $20 million fine for a bad tweet would ever consider returning to the platform, much less ... Tesla says customers can now buy a suped-up Model 3 at a lower price point. Here's a brief inventory of the comments Tesla CEO Elon Musk made this week about the Model 3 during the October 24 third-quarter earnings conference call. The Tesla Model 3 Performance sedan got a $5000 price cut on Friday. A Tesla spokesperson confirmed the price change to Business Insider on Friday. A bomb squad is investigating a suspicious package found at Hartsfield–Jackson Atlanta International Airport on Sunday morning, officials said. Atlanta police ... ATLANTA - Atlanta Police and Fire Departments have cleared the scene at Hartsfield-Jackson's International Terminal after their investigation into a "possible ... A “suspicious package” at Hartsfield–Jackson Atlanta International Airport was deemed harmless after it was investigated by a bomb squad Sunday morning, ... Red Dead Redemption 2 PC may not be a dream after all. The Companion App includes various references to graphics settings for a PC version. With an incredibly dynamic world to explore in Red Dead Redemption 2 on PS4 and Xbox One, we break down many of the game's more complex systems and ... This week is the perfect time to get a rare Xbox One console discount when you purchase Red Dead Redemption 2. Dig into some scary games to get into the ... As if we need to even ask the question this week, eh? Spoilers: practically everyone's playing Red Dead Redemption 2 this week. Let's see if the comments paint ... Red Dead Redemption 2 is out now on PS4 and Xbox One. We chat about the best ways to enjoy Rockstar's newest open-world, from incidental dialogue to ... We dropped a brand-new iPhone XR on the sidewalk to find out just how tough this phone is compared to the more expensive iPhone XS and yes, we broke the ... After beginning the iPhone XR teardown process yesterday, iFixit has now shared its full inside look at the device. The site prefaces its teardown by saying that if ... Our full review of the iPhone XR is here. How does it compare to the iPhone XS and Pixel 3? We answer that and much more in our exhaustive review. When Apple 's (ticker: APPL) first two new iPhones—the XS and XS Max—came out, many reviewers suggested that shoppers wait a few weeks until the slightly ... We've seen a similar icon before, back on the fifth beta of iOS 12. That icon showed an iPad with no Home button, rounded corners and no notch, but it was a ... Apple may have announced a whole slew of new hardware in September, but the Cupertino company isn't done yet: Apple has a second event on Tuesday, ... A new report backs up claims Apple's new iPad Pro will come with a redesigned body that borrows from the old, boxier iPhone 5. Apple is expected to announce a ton of new stuff this Tuesday, including a new iPad Pro with Face ID, a new MacBook Air, and maybe an iPad or Mac Mini. Apple's 2018 iPad Pro refresh will witness a major overhaul over its predecessor confirms a latest report. Take a look! You know how all the fancy new cars out there have LED headlights? Well there's a reason to be jealous of them aside from the fact that they look cooler than ... "Halloween" easily stayed No. 1 at the domestic box office in its second weekend as the spooky holiday nears. The weekend played out mostly as expected with a repeat of last weekend's top four films, led by Universal's Halloween, which has now delivered over $126 ... The David Gordon Green-directed Halloween sequel has slashed up the competition for the second straight week, topping the box office with another estimated. Blumhouse and Universal's 'Halloween' has no doubt decided on its All Hallows' Eve costume — profit monster — after earning a stellar $32 million in its ... October box office revenue has hit a record $789.9 million, with a few days left to go. The Duchess of Sussex, formerly Meghan Markle, has said "Bravo New Zealand" on the 125th anniversary of women's right to vote. Meghan Markle might be following in Kate Middleton's footsteps as the next royal photographer! The Duchess of Sussex, 37, took a sweet photo of her husband, ... Prince Harry and Meghan Markle left Australia and arrived in New Zealand on Sunday, Oct. 28, 2018 as they continued their tour of their tour through the regi... Does anyone have the number for Shopaholics Anonymous? Megyn Kelly is out at NBC. Things aren't official as of yet, but numerous reports indicate the host won't be returning to her 9 a.m. show Megyn Kelly Today. The Oscar winner is playing the role of Kelly in a new film about Roger Ailes. With Megyn Kelly's firing, NBC seems to have forgotten who she is and always has been. Megyn Kelly has walked our halls and strolled our streets; she's a proud member of our high school's hall of fame, and her work has put our hometown of ... Rapper Tekashi 6ix9ine will only receive four years... The president tweeted his criticism after the Dodgers pulled their starter with a lead in the seventh inning. They ended up losing to the Red Sox, 9-6. When the Dodgers have been in precarious situations in the middle innings this postseason, when the opposition is threatening with runners on base and the ... Inspired by their ace, the Red Sox piled up nine runs against the Dodgers' bullpen to gain a 3-1 lead and come back from the longest loss in World Series ... President Trump took to Twitter late Saturday night, just hours after a deadly mass shooting in Pittsburgh, to criticize the Los Angeles Dodgers' pitching moves ... CLEVELAND, Ohio -- The Cleveland Cavaliers have fired head coach Tyronn Lue, sources told cleveland.com. The Cavs were hoping to overachieve this ... The Cleveland Cavaliers fired coach Ty Lue on Sunday and plan to promote Larry Drew to interim coach, league sources told ESPN. Cleveland has started the ... CLEVELAND (AP) -- Cleveland Cavaliers forward Kevin Love was sidelined with a sore foot for Saturday night's 119-107 loss to the Indiana Pacers. The defeat ... Tyronn Lue's time with the Cleveland Cavaliers will reportedly be cut short. According to Shams Charania of The Athletic, the Cavaliers will fire Lue after an 0-6 ... Four Jacksonville Jaguars players were detained, and three were arrested, after they ran up a tab of £50000 ($64000 U.S.) at a London club that “features ... The Jaguars said four players were detained in London "over restitution of a bill." A source confirmed to ESPN that the players involved were Barry Church, D.J. ... The Philadelphia Eagles may have just salvaged their season. Led by a strong performance from Carson Wentz , the Eagles defeated the Jacksonville Jaguars ... LONDON -- Eagles right tackle Lane Johnson was carted off the field with a knee injury in the first quarter of Sunday's game against the Jacksonville Jaguars at ... The Jacksonville Jaguars say four players were detained over restitution of a bill in London. The Jaguars play the Philadelphia Eagles at Wembley Stadium on ... Elina Svitolina beats Sloane Stephens to claim the biggest title of her career at the WTA Finals in Singapore. SINGAPORE (AP) — Elina Svitolina secured the biggest title of her career on Sunday, becoming the first Ukrainian player to win the season-ending WTA Finals ... Sloane Stephens dug deep to produce the "best comeback" of her career in a stunning semi-final triumph against Karolina Pliskova in Singapore, an epic ...
