2.0-split-http://bbc.com/-split-A husband and wife, and a woman of 97 are among the 11 people killed in Saturday's synagogue attack. What we know so far about the shooting at the Tree of Life Congregation Synagogue in Pittsburgh. It is understood four people were on the helicopter with the owner when it crashed outside the stadium. With the future of abortion access in the US increasingly in question, more women are looking elsewhere. Three matches in the Premier League on Sunday - follow BBC Radio 5 live commentary, live text, social media, images and analysis. Former England manager and Tottenham midfielder Glenn Hoddle remains in a serious condition in hospital after suffering a heart attack on Saturday. Reaction after the helicopter belonging to Leicester City owner Vichai Srivaddhanaprabha crashes in a car park outside the club's ground. See the stunning illusions this artist creates using only makeup How the Italian city of Bologna is getting people to leave their cars behind Twenty thousand people watch her live-stream and sell her products  3°C 10°C 6°C 9°C 5°C 13°C 8°C Failing to understand this phrase is not unusual The luxurious avant-garde living spaces of movie stars in southern California Featuring Fantastic Beasts, The Grinch and Van Gogh Surprise: younger isn’t always better Christine Selinger wants to help other differently abled people Despite the shortening days, a handful of species are clocking in some serious overtime Spoiler: I tried. I failed. I tried harder Pittsburgh's Squirrel Hill community speak of their shock following a fatal shooting in a local synagogue. Watch the entire first season on BBCAmerica.com or the BBCA app Micro drones pull heavy objects and other technology news stories of the week. The streaming service from the BBC and ITV is the biggest collection of British TV in one place. The singer performs from an arena balcony after a gig in Prague gets cancelled over safety. A global study suggests people prefer to save young over elderly people. The transport secretary says the government will back major development on the Oxford-Cambridge arc. What are some of the dangers of supplements and how beneficial are they for our health? This week the boss of Apple warned about our personal data being 'weaponised against us'. The tech giant says it dismissed 48 employees, including 13 senior managers, over the past two... An exhibition of Roman Vishniac, one of the most important documentary photographers of the 20th... حمله به کنیسه یهودیان در پیتزبورگ؛ مظنون رسما متهم به قتل شد Elecciones en Brasil 2018: cuáles son las propuestas de los candidatos Bolsonaro y Haddad ’اسرائیل کے ساتھ تعلقات کی کوئی تجویز زیر غور نہیں‘ Anh: Trực thăng của ông chủ Leicester rơi
2.0-split-http://www.bbc.com/-split-A husband and wife, and a woman of 97 are among the 11 people killed in Saturday's synagogue attack. What we know so far about the shooting at the Tree of Life Congregation Synagogue in Pittsburgh. It is understood four people were on the helicopter with the owner when it crashed outside the stadium. With the future of abortion access in the US increasingly in question, more women are looking elsewhere. Three matches in the Premier League on Sunday - follow BBC Radio 5 live commentary, live text, social media, images and analysis. Former England manager and Tottenham midfielder Glenn Hoddle remains in a serious condition in hospital after suffering a heart attack on Saturday. Reaction after the helicopter belonging to Leicester City owner Vichai Srivaddhanaprabha crashes in a car park outside the club's ground. See the stunning illusions this artist creates using only makeup How the Italian city of Bologna is getting people to leave their cars behind Twenty thousand people watch her live-stream and sell her products  3°C 10°C 6°C 9°C 5°C 13°C 8°C Failing to understand this phrase is not unusual The luxurious avant-garde living spaces of movie stars in southern California Featuring Fantastic Beasts, The Grinch and Van Gogh Surprise: younger isn’t always better Christine Selinger wants to help other differently abled people Despite the shortening days, a handful of species are clocking in some serious overtime Spoiler: I tried. I failed. I tried harder Pittsburgh's Squirrel Hill community speak of their shock following a fatal shooting in a local synagogue. Watch the entire first season on BBCAmerica.com or the BBCA app Micro drones pull heavy objects and other technology news stories of the week. The streaming service from the BBC and ITV is the biggest collection of British TV in one place. The singer performs from an arena balcony after a gig in Prague gets cancelled over safety. A global study suggests people prefer to save young over elderly people. The transport secretary says the government will back major development on the Oxford-Cambridge arc. What are some of the dangers of supplements and how beneficial are they for our health? This week the boss of Apple warned about our personal data being 'weaponised against us'. The tech giant says it dismissed 48 employees, including 13 senior managers, over the past two... An exhibition of Roman Vishniac, one of the most important documentary photographers of the 20th... حمله به کنیسه یهودیان در پیتزبورگ؛ مظنون رسما متهم به قتل شد Elecciones en Brasil 2018: cuáles son las propuestas de los candidatos Bolsonaro y Haddad ’اسرائیل کے ساتھ تعلقات کی کوئی تجویز زیر غور نہیں‘ Anh: Trực thăng của ông chủ Leicester rơi
2.0-split-http://www.wsj.com/-split-BROWSER UPDATE To gain access to the full experience, please upgrade your browser: Chrome | Safari | Firefox | Internet Explorer Note: If you are running Internet Explorer 10 and above, make sure it is not in compatibility mode. October 28, 2018 A woman holds flowers on Sunday outside of the Tree of Life Synagogue in the Squirrel Hill neighborhood of Pittsburgh. The diverse neighborhood of Squirrel Hill has long been the heart of the city’s Jewish population. BRENDAN SMIALOWSKI/AGENCE FRANCE-PRESSE/GETTY IMAGES Local authorities released the names of the 11 people who died after a gunman stormed into a place of worship, leaving the city’s Jewish community mourning. 200 The Pittsburgh synagogue shooting on Saturday and the arrest days earlier in the case of pipe bombs sent to prominent Democrats are forcing Republicans and Democrats to adapt on the fly in the final full week of campaigning before midterm elections. 51 Investors are selling the shares of firms that hit quarterly earnings expectations at the highest rate since 2011, a sign of concern over how long the good times can last for American corporations. Trade disagreements with China make growing soybeans unprofitable for U.S. farmers, forcing them to reconsider their planting choices. Inspired by the EU, more governments across the world are contemplating a tax based on the revenue of foreign technology companies like Facebook and Google rather than their profit. Embattled company needs to save its cash to fix its business, they say. Brazilians began voting Sunday in a divisive presidential race expected to elect combative ex-army captain Jair Bolsonaro, shifting the country’s politics sharply to the right. Where to travel in 2019? The world’s best secret restaurants? How to power-trip at work? Because life is always more manageable in list form, we’ve ranked, tallied and indexed...pretty much everything. FootGolf, an unusual hybrid of soccer and golf, was enough to motivate a Miami man to get in shape. New TV dramas like “Homecoming,” “Maniac” and “Legion” are exploring the issues unsettling society with characters who struggle to maintain a grip on reality. The original Frankenstein has spawned a whole category of stitched-together Frankenwords. Israel is conducting a military campaign across Syria against Iran-backed militia groups, an effort that has been encouraged by the White House but aroused the concern of many U.S. military officials. Defense Secretary Jim Mattis said any role Saudi Arabia played in a journalist’s killing could destabilize the Persian Gulf region and beyond. 165 A port being developed in the southern Iranian city of Chabahar underscores some of the dilemmas U.S. policy makers face in implementing sanctions against Tehran. Pope Francis told a gathering of bishops from around the world that the Catholic Church is being persecuted through accusations—an apparent allusion to clerical sex-abuse scandals. 71 Sony Corp. hopes its latest noise-canceling headphones will help it cancel years of financial losses Tesla, with a fresh civil fraud settlement now behind it, faces a new legal problem: a deepening criminal probe. 341 Owners of forest land along the Florida Panhandle and beyond are grappling with at least $1.6 billion in timber losses after Hurricane Michael. An outcry over remarks Ms. Kelly made on the air about blackface Halloween costumes on Tuesday proved the last straw in the anchor’s rocky stint on the ‘Today’ show. NBC canceled her show Friday. Negotiations “about next steps” continue, her lawyer said. 407 Democrats and Republicans are launching new criticisms over the Affordable Care Act and pre-existing conditions coverage. Liberal-arts majors often fare better in avoiding underemployment than those who pursue more vocationally geared majors, such as degrees in parks, recreation, leisure and fitness studies and homeland security. 294 Republicans and Democrats are sparring on the campaign trail over who gets credit and blame for the economy. Support for the president isn’t always translating into support for local Republicans on economic issues. To go from a mere Type A to a Type A+, consider these inspiring suggestions. You’ll never vacation, ask for raises, ascend Mount Everest, eat pizza or blow bubbles the complacent way again. 55 Megyn Kelly's 'Blackface' Remarks 11 Killed at Pittsburgh Synagogue Letter Bomb Suspect Arrested as More Packages Found Megyn Kelly in April 2018 Interview: ‘Hopefully They Believe in Me’ Advice for Making Work Better for Men and Women U.S. Economy Flashes Signs It’s Downhill From Here Suspect in Synagogue Shooting Driven by Hatred At Netflix, Radical Transparency and Blunt Firings Unsettle the Ranks Tesla Faces Criminal Probe Over Whether It Misstated Production After Months of Struggle, NBC’s $69 Million Bet on Megyn Kelly Flames Out We’re bombarded with information, giving us little time to focus on any of it. It’s a recipe for making bad choices about our money. WSJ Membership Customer Service Tools & Features Ads More
2.0-split-https://www.foxnews.com/us.html-split-This material may not be published, broadcast, rewritten, or redistributed. ©2018 FOX News Network, LLC. All rights reserved. All market data delayed 20 minutes. The victims of the massacre at a synagogue in Pittsburgh included a grandfather, husband and wife, and two brothers, officials and family members revealed as new details about the alleged gunman behind the deadly rampage were released Sunday. The man in charge of running Panama City's recovery from Hurricane Michael is a two-star Army general who started the job just two weeks before the storm. The Latest on a deadly shooting at a Pittsburgh synagogue (all times local): 7 a.m. Former Secret Service agent Dan Emmett says that even though a suspect is in custody, the investigation is far from over. Voters to decide on proposal that would ban the sale of eggs, meat from animals raised in confined spaces; Douglas Kennedy reports on the implications for farmers across the country. The victims of the massacre at a synagogue in Pittsburgh included a grandfather, husband and wife, and two brothers, officials and family members revealed as new details about the alleged gunman behind the deadly rampage were released Sunday. The Latest on the winning tickets sold for the Powerball jackpot (all times local): 10:30 a.m. Melvin Wax was the first to arrive at New Light Congregation in Pittsburgh's Squirrel Hill neighborhood — and the last to leave. The FBI scours suspect Robert Bowers, charged with hate crimes. Superstorm Sandy roared into the New York area six years ago Monday. The Czech Republic's prime minister has told U.S. Defense Secretary Jim Mattis that a possible U.S. withdrawal from a landmark nuclear weapons treaty would be wrong. More than 700,000 immigrants are waiting on applications to become U.S. citizens, a process that once typically took about six months but has stretched to more than two years in some places. Authorities believe alleged gunman Robert Bowers acted alone and was driven by his hatred of Jews; David Lee Miller reports from Pittsburg on what more is being learned about the suspect. Two winning tickets were sold in Saturday night's Powerball drawing to win a $688 million jackpot, which marks the fourth-largest lottery grand prize ever in U.S. history. Todd Piro talks to voters following the president's Make America Great Again rally in Illinois. Todd Piro talks to Illinois voters following Trump's rally. The fourth-largest jackpot in U.S. history has two winners. One is in New York, the other is in Iowa. It's time for the 'Fox and Friends' Halloween parade! During the week, anyone who wanted to get inside Pittsburgh's Tree of Life synagogue had to ring the doorbell and be granted entry by staff because the front door was kept locked. Florida authorities have linked six more deaths to Hurricane Michael, raising the state's death toll to 35. Rabbi Shumley Boteach, Father Jonathan Morris and Dr. Qanta Ahmed react to the deadly attack on the Tree of Life synagogue. Five people are missing as the U.S. Coast Guard continues to search for a downed civilian aircraft that was headed to the Bahamas from South Carolina on Thursday. The reward for information leading to the location of Jayme Closs doubled Saturday as family and friends gathered to pay their respects to the couple. President Donald Trump mourned the dead and forcefully condemned anti-Semitism after a mass shooting at a Pittsburgh synagogue that left 11 dead. This material may not be published, broadcast, rewritten, or redistributed. ©2018 FOX News Network, LLC. All rights reserved. All market data delayed 20 minutes.
2.0-split-http://www.bbc.com/#-split-A husband and wife, and a woman of 97 are among the 11 people killed in Saturday's synagogue attack. What we know so far about the shooting at the Tree of Life Congregation Synagogue in Pittsburgh. It is understood four people were on the helicopter with the owner when it crashed outside the stadium. With the future of abortion access in the US increasingly in question, more women are looking elsewhere. Three matches in the Premier League on Sunday - follow BBC Radio 5 live commentary, live text, social media, images and analysis. Former England manager and Tottenham midfielder Glenn Hoddle remains in a serious condition in hospital after suffering a heart attack on Saturday. Reaction after the helicopter belonging to Leicester City owner Vichai Srivaddhanaprabha crashes in a car park outside the club's ground. See the stunning illusions this artist creates using only makeup How the Italian city of Bologna is getting people to leave their cars behind Twenty thousand people watch her live-stream and sell her products  3°C 10°C 6°C 9°C 5°C 13°C 8°C Failing to understand this phrase is not unusual The luxurious avant-garde living spaces of movie stars in southern California Featuring Fantastic Beasts, The Grinch and Van Gogh Surprise: younger isn’t always better Christine Selinger wants to help other differently abled people Despite the shortening days, a handful of species are clocking in some serious overtime Spoiler: I tried. I failed. I tried harder Pittsburgh's Squirrel Hill community speak of their shock following a fatal shooting in a local synagogue. Watch the entire first season on BBCAmerica.com or the BBCA app Micro drones pull heavy objects and other technology news stories of the week. The streaming service from the BBC and ITV is the biggest collection of British TV in one place. The singer performs from an arena balcony after a gig in Prague gets cancelled over safety. A global study suggests people prefer to save young over elderly people. The transport secretary says the government will back major development on the Oxford-Cambridge arc. What are some of the dangers of supplements and how beneficial are they for our health? This week the boss of Apple warned about our personal data being 'weaponised against us'. The tech giant says it dismissed 48 employees, including 13 senior managers, over the past two... An exhibition of Roman Vishniac, one of the most important documentary photographers of the 20th... حمله به کنیسه یهودیان در پیتزبورگ؛ مظنون رسما متهم به قتل شد Elecciones en Brasil 2018: cuáles son las propuestas de los candidatos Bolsonaro y Haddad ’اسرائیل کے ساتھ تعلقات کی کوئی تجویز زیر غور نہیں‘ Anh: Trực thăng của ông chủ Leicester rơi
